experiment	compressed_bytes	raw_bytes	ratio	max_abs_error	status	description
baseline	15513031	27006130	0.5744	0.0	baseline	torch.save + zstd-22
exp1_lzma_extreme	15824088	27006130	0.5860	0.0	reverted	torch.save + LZMA extreme (preset 9)
exp2_transpose	15500303	27006130	0.5740	0.0	kept	transpose 2D tensors + zstd-22
exp3_separate_streams	15350003	27006130	0.5684	0.0	kept	separate dtype streams + transpose + zstd-22
exp4_type_grouping	15370267	27006130	0.5691	0.0	reverted	group tensors by type across layers
exp5_row_interleave	15407265	27006130	0.5705	44.0	reverted	row-interleave same-shape int8 tensors (buggy)
exp6_fine_streams	15446020	27006130	0.5720	0.0	reverted	split into int6_q/int8_q/int6_scale/etc. streams
exp7_ldm	15350001	27006130	0.5684	0.0	reverted	enable long distance matching (-2 bytes)
exp8_byte_shuffle	15335927	27006130	0.5679	0.0	kept	byte-shuffle fp16 and fp32 streams
exp9_lzma_fp16	15334299	27006130	0.5679	0.0	kept	LZMA extreme for byte-shuffled fp16 stream
exp10_lzma_int8	15631066	27006130	0.5789	0.0	reverted	LZMA extreme for int8 stream (worse)
exp11_unsigned_offset	15334876	27006130	0.5679	0.0	reverted	offset int8 to unsigned (+577b)
exp11b_zlib_adaptive	15334299	27006130	0.5679	0.0	reverted	adaptive zstd/zlib (zstd always wins)
exp12_no_transpose	15334875	27006130	0.5679	0.0	reverted	ablation: no transpose (+576b)
exp13_zstd_params	15334298	27006130	0.5679	0.0	reverted	higher search_log/chain_log (-1 byte)
exp13b_nibble_split	17443868	27006130	0.6459	0.0	reverted	nibble split int8 (+12.4% worse)
exp14_zstd_target	15334299	27006130	0.5679	0.0	reverted	zstd target_length=4096 (identical)
exp14b_brotli	15334300	27006130	0.5679	0.0	reverted	brotli-11 for int8 (zstd still wins)
exp15_sub_filter	17002692	27006130	0.6296	0.0	reverted	PNG sub filter (-9.6% worse)
exp16_single_frame	15336164	27006130	0.5680	0.0	reverted	single zstd frame (+1.9KB vs multi-stream)
exp17_json_lzma_header	15334024	27006130	0.5679	0.0	kept	JSON+LZMA header (-275 bytes)
exp18_sign_magnitude	15597005	27006130	0.5776	0.0	reverted	sign-magnitude split (-0.5% worse)
exp19_minmatch4	15349680	27006130	0.5685	0.0	reverted	zstd min_match=4 (+15KB worse)
exp19b_lzma_fp32	15334024	27006130	0.5679	0.0	reverted	LZMA for fp32 (identical)
exp21_size_order	15535359	27006130	0.5754	0.0	reverted	order int8 by size (-22KB worse)
exp22_multithread	15334024	27006130	0.5679	0.0	reverted	zstd multi-threaded (identical)
exp23_xor_consecutive	N/A	N/A	N/A	N/A	reverted	XOR consecutive same-shape (decoder bug)
exp24_zigzag	15330719	27006130	0.5678	0.0	kept	zigzag encoding for int8 (-3.3KB new best!)
exp25_no_transpose_zigzag	15331915	27006130	0.5678	0.0	reverted	no transpose with zigzag (+1.2KB worse)
exp26_natural_sort	15331155	27006130	0.5678	0.0	reverted	natural sort order (+436b worse)
exp26b_overlap_log	15330719	27006130	0.5678	0.0	reverted	zstd overlap_log=9 (identical)
exp27_zigzag_lzma	15330720	27006130	0.5678	0.0	reverted	zigzag+LZMA adaptive (+1b, zstd still wins)
exp29_reversed_zigzag	15330531	27006130	0.5678	0.0	kept	reversed zigzag (-188b new best!)
exp30_freq_permutation	15331147	27006130	0.5678	0.0	reverted	frequency permutation table (+616b, table overhead)
exp31_strategy8	15333190	27006130	0.5679	0.0	reverted	zstd strategy=8 btultra (+2.7KB)
exp31b_reverse_order	15439811	27006130	0.5718	0.0	reverted	reverse int8 order (+109KB)
exp32_indexed_header	15330451	27006130	0.5677	0.0	kept	indexed header format (-80b new best!)
exp33_zstd_dict256	15329145	27006130	0.5677	0.0	kept	256-byte zstd dictionary (-1.3KB!)
exp34_merge_fp_streams	15329153	27006130	0.5677	0.0	reverted	merge fp16+fp32 LZMA (+8b worse)
exp35_skip_empty_fp32	15329141	27006130	0.5677	0.0	kept	skip empty fp32 block (-4b)
exp36_lzma2_lp1	15328213	27006130	0.5676	0.0	kept	tuned LZMA2 lp=1 for fp16 (-928b new best!)
exp37_raw_lzma2_header	15328157	27006130	0.5676	0.0	kept	raw LZMA2 for header (-56b)
exp38_lzma2_header_tuned	15328120	27006130	0.5676	0.0	kept	LZMA2 lc=0/lp=0/pb=0 for header (-37b)
exp39_remove_t_field	15328070	27006130	0.5676	0.0	kept	derive transposed from shapes (-50b)
exp40_derive_g_b	15328063	27006130	0.5676	0.0	kept	derive fp32_keys and byte_shuffle (-7b)
exp41_compact_meta	15327864	27006130	0.5676	0.0	kept	compact type string meta (-199b!)
exp42_short_keys	15327768	27006130	0.5676	0.0	kept	abbreviated key names (-96b)
exp43_gray_code	15328081	27006130	0.5676	0.0	reverted	Gray code on zigzag (+313b worse)
exp44_2byte_header_len	15327766	27006130	0.5676	0.0	kept	2-byte header length prefix (-2b)
exp45_no_dict_len	15327764	27006130	0.5676	0.0	kept	remove dict_len field (-2b)
exp46_compress_dict	15327714	27006130	0.5676	0.0	kept	zlib-compress dictionary (-50b)
exp47_standard_zigzag	15327607	27006130	0.5676	0.0	kept	standard zigzag better than reversed with dict (-107b!)
exp48_derive_dtype	15327424	27006130	0.5676	0.0	kept	derive dtype from key suffixes (-183b!)
exp49_lzma_delta_fp16	N/A	N/A	N/A	0.0	reverted	LZMA delta filter for fp16 (+8.8KB worse)
exp49b_msgpack	N/A	N/A	N/A	0.0	reverted	msgpack header (+6b worse than JSON)
exp49c_window_log	N/A	N/A	N/A	0.0	reverted	smaller window_log (1b difference)
exp50_xor_rows	16549178	27006130	0.6128	0.0	reverted	XOR rows with previous (-6.7% worse)
exp51_no_content_size	15327421	27006130	0.5676	0.0	kept	disable content_size in zstd frame (-3b)
exp52_cross_layer_residual	N/A	N/A	N/A	N/A	skipped	pre-check: residual entropy higher than raw
exp52b_tensor_sim_order	15176072	N/A	N/A	0.0	reverted	histogram similarity ordering (+3.7KB)
exp52c_zpaq_m5	15034441	26738688	0.5624	0.0	diagnostic	zpaq headroom: -138KB vs zstd (64s encode)
exp52d_two_pass	N/A	N/A	N/A	N/A	reverted	two-pass compression all worse
exp52e_row_permute	N/A	N/A	N/A	N/A	skipped	pre-check: rows independent (6.16% match)
exp53_flush_block	15327403	27006130	0.5676	0.0	kept	streaming zstd with per-tensor flush_block (-18b)
exp54_order0_predict	16381632	26738688	N/A	0.0	reverted	order-0 byte prediction (+1.2MB worse)
exp54b_cross_tensor_xor	16767299	26738688	N/A	0.0	reverted	XOR with prev same-size tensor (+1.6MB)
exp55_arch_params	15327351	27006130	0.5676	0.0	kept	derive shapes from arch params (-52b)
exp56_per_tensor_ans	15212620	27006130	0.5633	0.0	kept	per-tensor ANS replaces zstd for int8 (-114,731 = -1.94%!)
exp57_u16_freq	15203916	27006130	0.5630	0.0	kept	uint16 freq tables (-8.7KB)
exp58_lzma_freq	15199564	27006130	0.5628	0.0	kept	LZMA-compressed freq tables (-4.4KB = -2.02%!)
exp59_no_transpose	15199435	27006130	0.5628	0.0	kept	remove unnecessary transpose (-129b)
exp60_kmeans_cluster	15156254	27006130	0.5612	0.0	kept	K=16 row-distribution clustering (-43KB = -2.30%!)
exp61_hellinger	15150333	27006130	0.5610	0.0	kept	Hellinger K-means distance metric (-3.8KB = -2.34%)
exp62_single_stream	15150085	27006130	0.5610	0.0	kept	single-stream ANS + derive nrows (-248b = -2.34%)
exp33_zstd_dict256	15329145	27006130	0.5677	0.0	kept	256-byte zstd dictionary (-1.3KB new best!)
