experiment	compressed_bytes	raw_bytes	ratio	max_abs_error	status	description
torch_save_baseline	15513031	27006130	0.5744	0.0	baseline	torch.save + zstd-22 (original)
fork_baseline	15513031	27006130	0.5744	0.0	baseline	torch_save_fork + zstd-22 (byte-identical to torch.save)
P3-1_dtype_reorder	15384952	27006130	0.5697	0.0	kept	reorder storages by dtype (int8→fp16→fp32)
P3-2_size_sort	15579437	27006130	0.5769	0.0	reverted	sort by size within dtype (+194KB worse!)
P3-3_zigzag_int8	15380456	27006130	0.5695	0.0	kept	zigzag encode int8 storages (-4.5KB from P3-1)
P3-4_transpose	15454015	27006130	0.5722	0.0	reverted	transpose 2D tensors (+73KB worse)
P3-5_align1	15380278	27006130	0.5695	0.0	kept	storage alignment=1 (-178b)
P3-6_byte_shuffle_fp16	15366650	27006130	0.5690	0.0	kept	byte-shuffle fp16 storages (-13.6KB!)
P3-7_pickle5	15375674	27006130	0.5693	0.0	reverted	pickle protocol 5 (+9KB worse)
P3-8_no_byteorder	15366922	27006130	0.5690	0.0	reverted	skip byteorder record (+272b worse)
P3-9_strip_meta	15366305	27006130	0.5690	0.0	kept	remove .format_version and .storage_alignment (-345b)
P3-10_zstd_dict	15370892	27006130	0.5692	0.0	reverted	zstd dictionary for outer compression (+4.6KB)
P3-11_no_content_size	15366302	27006130	0.5690	0.0	kept	outer zstd write_content_size=False (-3b)
P3-12_no_crc32	15359990	27006130	0.5687	0.0	kept	disable CRC32 in ZIP (-6.3KB!)
P3-13_skip_serialid	15359912	27006130	0.5687	0.0	kept	skip serialization_id record (C++) (-78b)
P3-13b_no_fbxx	15359307	27006130	0.5687	0.0	kept	remove FBXX padding when alignment=1 (C++) (-605b)
P3-14_short_archname	15360273	27006130	0.5687	0.0	reverted	short archive name "a" (+966b worse)
P3-15_no_dd	15359380	27006130	0.5687	0.0	reverted	remove DD flag in miniz (+73b worse, false positive)
P3-16_fp32_shuffle	819512	27006130	N/A	0.0	reverted	fp32 byte-shuffle (BUGGY: misclassified dtypes)
P3-17_fp16_first	15533859	27006130	0.5751	0.0	reverted	fp16→int8→fp32 order (+174KB worse)
P3-18_pickle_compress	N/A	N/A	N/A	N/A	skipped	pickle already compressed by outer zstd
P3-19_merge_storages	15361794	27006130	0.5688	0.0	reverted	merge same-dtype storages (+2.5KB despite -22KB raw)
P3-20_streaming_flush	15346648	27006130	0.5683	0.0	kept	streaming zstd with flush_block at ZIP entries (-12.7KB!)
P3-21_flush_every7	15341741	27006130	0.5681	0.0	kept	tune flush to every 7 entries (-4.9KB)
P3-22_split_lzma	15339441	27006130	0.5680	0.0	kept	split: streaming zstd + LZMA for fp16/meta (-2.3KB)
P3-23_lzma_params	15339077	27006130	0.5680	0.0	kept	tune LZMA lp=0 for part 2 (-364b)
P3-24_3way_split	15341332	27006130	0.5681	0.0	reverted	3-way split (+2.3KB, extra overhead)
P3-24b_brotli	15993406	N/A	N/A	0.0	reverted	brotli for int8 region (+672KB)
